{
  "$schema": "https://json-schema.org/draft/2020-12/schema",
  "$id": "https://bitpanda.internal/architecture-map/process-pack.schema.json",
  "title": "Process pack",
  "description": "A set of business processes \u2014 the L1/L2/L3 hierarchy \u2014 and the components each one uses. The levels are DECOMPOSITION, not sequence: each level says the same thing in more detail, so L1.1.1 is a more granular description of part of L1.1, not a hop within it. A level 3 is therefore already the atomic unit of work ('Get prices from the pricing service'), and there is no step list beneath it \u2014 if something needs breaking down further, it is a sibling at the same level. Order comes from the numbering: 1.1 happens before 1.2. Unlike a scan manifest, which is derived from code and covers one repository, a pack is authored by people and spans every repository its processes run through. A pack NEVER creates a component: it only references components a scan already established, and a reference that does not resolve is reported as a finding, because it means either the scan missed something or this document is stale.",
  "type": "object",
  "additionalProperties": false,
  "required": [
    "schemaVersion",
    "pack",
    "name",
    "authoredAt",
    "producer",
    "processes"
  ],
  "properties": {
    "schemaVersion": {
      "const": 1,
      "description": "Version of this schema. Always 1."
    },
    "promptVersion": {
      "type": "string",
      "description": "Version of the authoring prompt that produced this pack, when one did. Copy it verbatim from the prompt.",
      "maxLength": 40
    },
    "pack": {
      "type": "string",
      "description": "Stable id for this pack, lowercase. The unit of re-ingest: loading a pack replaces every process it previously contributed and touches nothing else. Split packs by domain or owning team, e.g. 'order-and-execution', 'onboarding'.",
      "pattern": "^[a-z0-9][a-z0-9._-]*$",
      "maxLength": 80
    },
    "name": {
      "type": "string",
      "description": "Human-readable name for the pack, e.g. 'Order and execution'."
    },
    "description": {
      "type": "string",
      "description": "What this pack covers, and just as usefully what it does not.",
      "maxLength": 800
    },
    "covers": {
      "type": "object",
      "description": "What this pack is about: the boundary its processes live inside. Write it once, at the top, and it does three things. It tells a reader what the pack is for without opening it. It scopes the authoring prompt, so whoever writes the next version is handed this boundary's components rather than the whole estate. And it makes a handoff that leaves the boundary visible as a handoff rather than as an ordinary step \u2014 which is the point of documenting processes across teams at all. Naming a component outside the boundary is reported, never rejected: a process genuinely does cross into other people's services, and that crossing is the interesting part.",
      "additionalProperties": false,
      "properties": {
        "team": {
          "type": "string",
          "description": "The team that owns this pack, as teams.json spells it \u2014 'trading', 'payments'. The default owner for every process in it that names none of its own.",
          "maxLength": 80
        },
        "services": {
          "type": "array",
          "description": "The services this pack documents, by id: ['svc:order-service', 'svc:matching-engine']. These are the ones the team runs, not every service its processes touch \u2014 a process calling somebody else's service is exactly what makes a boundary worth drawing.",
          "items": {
            "$ref": "#/$defs/nodeId"
          }
        },
        "repos": {
          "type": "array",
          "description": "The repositories this pack was written from, by the same name their scan manifests use. Optional, and only useful where a pack was authored by reading code: it is what lets a reader go from a process back to the repository it was derived from.",
          "items": {
            "type": "string",
            "maxLength": 200
          }
        }
      }
    },
    "authoredAt": {
      "type": "string",
      "format": "date-time",
      "description": "UTC timestamp when the pack was written or last revised, ISO 8601."
    },
    "producer": {
      "type": "object",
      "description": "Who or what wrote this pack. Ingest uses it to decide trust and precedence.",
      "additionalProperties": false,
      "required": [
        "kind"
      ],
      "properties": {
        "kind": {
          "enum": [
            "human",
            "claude",
            "import"
          ],
          "description": "'human' for hand-authored, 'claude' for an LLM draft, 'import' for a conversion from an existing document such as a Confluence page or a mermaid diagram."
        },
        "model": {
          "type": "string",
          "description": "Model id, when kind is 'claude'."
        },
        "author": {
          "type": "string",
          "description": "Who wrote or approved it."
        },
        "tool": {
          "type": "string",
          "description": "Converter and version, when kind is 'import'."
        }
      }
    },
    "source": {
      "$ref": "#/$defs/source",
      "description": "Default provenance for every process in the pack. A process may override it with its own `source`."
    },
    "processes": {
      "type": "array",
      "description": "Every process in the pack, as a FLAT list. The hierarchy is carried by `code`, not by nesting \u2014 do not nest children inside parents. Order within the list does not matter; the numbering decides it.",
      "minItems": 1,
      "items": {
        "$ref": "#/$defs/process"
      }
    }
  },
  "$defs": {
    "code": {
      "type": "string",
      "description": "The process number as people say it out loud: '1', '1.1', '1.1.1', and written 'L1', 'L1.1', 'L1.1.1' when the level prefix helps. An optional leading 'L' is accepted and stripped, so 'L1.1.1' and '1.1.1' are the same process. The code carries the whole hierarchy: the number of segments is the level, and the parent is the code with its last segment removed, so '1.1.1' is a level 3 whose parent is '1.1'. It also carries the order \u2014 1.1 comes before 1.2 \u2014 so siblings need no separate sequence field. A code belongs to THIS pack and nowhere else: start at 1, number what you are documenting, and do not try to fit around another pack's numbering. Every code except a level 1 must have its parent present in this pack. Segments are positive integers with no leading zeros. Codes are stable: people cite them as '<pack> L1.1.1' in tickets and documents, so renumbering is a real cost \u2014 pick a number and keep it.",
      "pattern": "^[Ll]?[1-9][0-9]*(\\.[1-9][0-9]*){0,2}$",
      "maxLength": 40
    },
    "processRef": {
      "type": "string",
      "description": "A reference to another process. A bare code \u2014 '2.1.3' or 'L2.1.3' \u2014 means a process in THIS pack, which is the overwhelming case: a team writing its own flow should not have to keep naming itself. To point at another pack's process, write '<pack>#<code>', for example 'order-and-execution#2.4.2'. Codes are per pack, so a bare code cannot reach outside this one \u2014 two packs both numbering from 1 are both right, and 'L1' on its own does not say whose. A reference nobody has written is reported as a finding, never rejected: the usual reason is that the team at the other end has not written their pack yet.",
      "pattern": "^([a-z0-9][a-z0-9._-]*#)?[Ll]?[1-9][0-9]*(\\.[1-9][0-9]*){0,2}$",
      "maxLength": 128
    },
    "nodeId": {
      "type": "string",
      "description": "A component id exactly as the topology holds it: 'svc:order-service', 'topic:orders.placed.v1', 'db:postgres/orders', 'cache:redis/session', 'api:pricing-service/GET /v1/rates/{}', 'contract:com.meridian.events.OrderPlaced', 'ext:stripe'. Never invent one \u2014 if the component you mean is not in the map, reference it anyway and let the finding surface; do not guess at a different id that happens to exist.",
      "pattern": "^(svc|topic|db|cache|api|contract|ext):\\S.*$",
      "maxLength": 300
    },
    "source": {
      "type": "object",
      "description": "Where this knowledge came from. Process facts are asserted by people, not derived from code, so they carry attribution rather than the file-and-line evidence a scan manifest carries. Do not fabricate a code citation for a process.",
      "additionalProperties": false,
      "properties": {
        "kind": {
          "enum": [
            "confluence",
            "diagram",
            "interview",
            "code",
            "runbook",
            "ticket",
            "other"
          ],
          "description": "What sort of source this is."
        },
        "url": {
          "type": "string",
          "description": "Link to the document, diagram or ticket."
        },
        "title": {
          "type": "string",
          "description": "Its title, so the reference survives a dead link."
        },
        "owner": {
          "type": "string",
          "description": "The person or team who confirmed this is accurate."
        },
        "asOf": {
          "type": "string",
          "description": "When it was last confirmed accurate, YYYY-MM-DD. A process nobody has confirmed in a year is worth knowing about."
        }
      }
    },
    "process": {
      "type": "object",
      "description": "One process at any level. The same shape serves all three: a level 1 is broad and usually names no component of its own, a level 3 is a single granular action and usually names exactly one. Nothing about a level 3 is special in the schema \u2014 it is simply a process that nothing decomposes further.",
      "additionalProperties": false,
      "required": [
        "code",
        "name"
      ],
      "properties": {
        "code": {
          "$ref": "#/$defs/code"
        },
        "name": {
          "type": "string",
          "description": "The process title, as a thing that is done: 'Get prices from the pricing service', not 'Pricing service call'. Short enough to read in a tree.",
          "maxLength": 200
        },
        "description": {
          "type": "string",
          "description": "What this process is and when it happens, in plain language a new joiner would understand. At level 1 describe the outcome for the customer or the business; at level 3 describe the actual work, including anything a reader would otherwise get wrong \u2014 retries, idempotency, what happens when it fails. Never restate the title.",
          "maxLength": 2000
        },
        "owner": {
          "type": "string",
          "description": "The team accountable for this process."
        },
        "actor": {
          "type": "string",
          "description": "Who performs it, when it is not the service in `node` \u2014 a customer, an operator, a scheduled job, an external provider."
        },
        "trigger": {
          "type": "string",
          "description": "What starts it. Most useful at level 1 and 2, where it is not obvious from the parent.",
          "maxLength": 300
        },
        "outcome": {
          "type": "string",
          "description": "What is true once it has finished.",
          "maxLength": 300
        },
        "node": {
          "$ref": "#/$defs/nodeId",
          "description": "The single component this process happens at or to \u2014 usually the service doing the work. A level 3 normally has exactly one. Leave it out at higher levels rather than guessing at the most important child's component; the parent's components are derived by rolling its children up."
        },
        "interaction": {
          "$ref": "#/$defs/interaction",
          "description": "The relationship this process travels over, when it crosses a boundary: a Kafka publish or consume, an HTTP call, a database or cache access. A level 3 that talks to something else almost always has one."
        },
        "touches": {
          "type": "array",
          "description": "Any further components this process uses beyond `node` and `interaction` \u2014 for a level 3 that genuinely reads two stores, or for a higher level whose children are not written yet. A parent's component list is DERIVED by rolling up its children, so never restate a child's components here.",
          "items": {
            "$ref": "#/$defs/nodeId"
          }
        },
        "handsOffTo": {
          "type": "array",
          "description": "Where this process hands over to another team. Normally written on a level 3, where the handoff actually happens; it rolls up to the levels above automatically, so never restate a child's handoff on its parent.",
          "items": {
            "$ref": "#/$defs/handoff"
          }
        },
        "next": {
          "type": "array",
          "description": "Where this process goes next, when it is not simply the next sibling. Leave it out and the flow falls through in numbering order, which is what almost every step does \u2014 write it only for the interesting cases: a decision with two outcomes, an error path that skips ahead, a retry that goes back, or a step that ends the process. Each entry is one branch: `when` is the condition in the reader's words, and then either `process` (the code it continues to) or `end` (a terminal outcome, when the process stops here). Two or more entries make it a decision; one entry with no `when` is an unconditional jump. A `process` code that nobody has written is reported as a finding, never rejected \u2014 the same rule handsOffTo follows. Normally written on a level 3, beside the step whose outcome decides the branch.",
          "items": {
            "$ref": "#/$defs/branch"
          }
        },
        "optional": {
          "type": "boolean",
          "description": "True when this only happens in some cases; say when in `description`. A cache miss fallback is the usual example."
        },
        "tags": {
          "type": "array",
          "description": "Free-form labels, e.g. 'regulated', 'customer-facing'.",
          "items": {
            "type": "string"
          }
        },
        "notes": {
          "type": "string",
          "description": "Anything that does not fit elsewhere: known issues, planned changes, why it is done this odd way.",
          "maxLength": 600
        },
        "source": {
          "$ref": "#/$defs/source"
        }
      }
    },
    "interaction": {
      "type": "object",
      "description": "A relationship in the topology, described the way a person can write it. Ingest resolves it to the edge the scan found, by the same from|kind|to key the scan used \u2014 you never write an edge id by hand. `from` is ALWAYS the service, exactly as in a scan manifest; `kind` carries the direction, so a process where a service consumes an event is still from the service to the topic.",
      "additionalProperties": false,
      "required": [
        "from",
        "kind",
        "to"
      ],
      "properties": {
        "from": {
          "$ref": "#/$defs/nodeId",
          "description": "Always the service, never the other end."
        },
        "kind": {
          "enum": [
            "kafka.produce",
            "kafka.consume",
            "db.read",
            "db.write",
            "db.owns",
            "cache.read",
            "cache.write",
            "http.call",
            "http.expose",
            "depends.on",
            "topic.schema"
          ],
          "description": "Same set a scan manifest uses; the two must match exactly or the interaction will not resolve."
        },
        "to": {
          "$ref": "#/$defs/nodeId",
          "description": "The other end: the topic, database, cache, endpoint, contract or external system."
        }
      }
    },
    "handoff": {
      "type": "object",
      "description": "A handoff to another team's process: the point where this process ends and theirs begins. Declare one ONLY where the code cannot show it \u2014 a nightly batch, a file drop, a person, a ticket, or an HTTP call whose receiving process you happen to know. A Kafka publish that another process consumes is DERIVED automatically from the topic and needs no declaration, though declaring it anyway is harmless and reads as agreement. Do not declare an ordinary synchronous call: calling an endpoint is a dependency on that team, not a handoff to one of their processes, and the map already shows it through the component you both touch.",
      "additionalProperties": false,
      "required": [
        "process"
      ],
      "properties": {
        "process": {
          "$ref": "#/$defs/processRef",
          "description": "The code of the process this one hands off to, with or without its 'L'. It may belong to a pack nobody has written yet \u2014 that is reported, not rejected, because 'we hand off to a team that is not on the map' is worth knowing."
        },
        "note": {
          "type": "string",
          "description": "Why, in one sentence, and especially HOW when the code cannot show it: 'a nightly export the risk team picks up', 'the operator emails the signed form'. This is the part a derived handoff does not have, and the reason a declaration is worth writing at all.",
          "maxLength": 400
        }
      }
    },
    "branch": {
      "type": "object",
      "description": "One outgoing branch of the flow. Exactly one of `process` and `end` \u2014 a branch either continues somewhere or finishes.",
      "additionalProperties": false,
      "oneOf": [
        {
          "required": [
            "process"
          ]
        },
        {
          "required": [
            "end"
          ]
        }
      ],
      "properties": {
        "when": {
          "type": "string",
          "description": "The condition, in the words a reader would use: 'the customer is permitted', 'the balance does not cover it', 'the cache misses'. Leave it out for an unconditional jump. Keep it short \u2014 it is drawn on the arrow.",
          "maxLength": 120
        },
        "process": {
          "$ref": "#/$defs/processRef",
          "description": "The process this branch continues to. Usually a sibling in this pack, written as a bare code; an error path out of a stage, or a step earlier in the list, which is how a retry loop is written. Another pack's process is '<pack>#<code>'."
        },
        "end": {
          "type": "string",
          "description": "A terminal outcome, written instead of `process` when the process stops on this branch: 'Order rejected', 'Escalated to an operator'. Drawn as the end of the flow.",
          "maxLength": 120
        }
      }
    }
  }
}
