{
  "schemaVersion": 1,
  "promptVersion": "2026-09-24a",
  "pack": "onboarding",
  "name": "Onboarding and funding",
  "description": "How a customer opens an account, is verified, and gets money onto the platform — the account record, the wallets, the session, the KYC decision and card funding. It stops where trading starts: pricing an order, placing it and settling it belong to order-and-execution. It does not cover withdrawals, refunds, chargebacks or any other reversal of a settled payment, closing an account, or how the verification provider reaches its decision, which happens outside the platform entirely.",
  "covers": {
    "team": "identity",
    "services": [
      "svc:identity-service",
      "svc:gateway-api",
      "svc:wallet-service",
      "svc:payments-service",
      "svc:ledger-service"
    ]
  },
  "authoredAt": "2026-09-17T15:30:00Z",
  "producer": {
    "kind": "import",
    "tool": "seed-demo/1"
  },
  "source": {
    "kind": "confluence",
    "url": "https://meridian.atlassian.net/wiki/spaces/ID/pages/204/Onboarding+and+funding",
    "title": "Onboarding and funding — process map",
    "owner": "identity",
    "asOf": "2026-08-14"
  },
  "processes": [
    {
      "code": "1",
      "name": "Onboarding and funding",
      "description": "A person becomes a customer the platform is allowed to do business with, and money they have paid in is recorded against them. The three stages are deliberately separable rather than one transaction: an account can exist unverified, and a verified account can sit empty, so nothing downstream may assume all three are true because one of them is.",
      "owner": "identity",
      "trigger": "Someone completes the signup form in the app.",
      "outcome": "A verified customer whose card payment has been captured and posted to the ledger, with the holds that signup placed now lifted.",
      "tags": [
        "customer-facing",
        "regulated"
      ]
    },
    {
      "code": "1.1",
      "name": "Opening an account",
      "description": "Everything that has to exist before the customer can do anything at all. None of it waits for verification — the account opens unverified, and the wallets it creates can take a deposit but not pay one out. The customer record, the wallets and the session are written by three different services, one of them off an event rather than a call, so nothing covers signup as a single transaction: a customer with a record and no wallets is the ordinary partial state, and the first symptom is a deposit with nowhere to land.",
      "owner": "identity",
      "outcome": "A customer record in the pending KYC state, a wallet per supported asset, and a session the customer is already logged in to."
    },
    {
      "code": "1.1.1",
      "name": "Create the customer record",
      "description": "The KYC state starts at pending on this row, and it is the copy a service reads when it asks identity directly — the order service checks it before it will price anything. It is not what releases the wallet's holds; the approval event in 1.2.2 does that. The email address is the uniqueness constraint, so a resubmitted signup fails here rather than quietly producing a second customer with a second set of wallets.",
      "owner": "identity",
      "node": "svc:identity-service",
      "interaction": {
        "from": "svc:identity-service",
        "kind": "db.write",
        "to": "db:postgres/identity"
      }
    },
    {
      "code": "1.1.2",
      "name": "Announce the new customer",
      "description": "One event, three independent consumers: the wallets are opened, the welcome mail goes out, and payments creates its own customer record ahead of the first card being used. None of the three are coordinated and none acknowledge anything back, so identity treats the publish as done the moment the broker accepts it. A consumer that is simply down loses nothing — it resumes from its offset and the wallets appear late — but one that takes the event and fails to process it loses that signup outright, because there is no dead-letter path and nothing reconciles the three afterwards. The row in 1.1.1 is committed and then this event is published, as two operations rather than one, so a crash in between leaves a customer who exists with no wallets and no event that will ever be redelivered.",
      "owner": "identity",
      "node": "svc:identity-service",
      "interaction": {
        "from": "svc:identity-service",
        "kind": "kafka.produce",
        "to": "topic:users.created.v2"
      },
      "handsOffTo": [
        {
          "process": "L1.1.3",
          "note": "Wallet opens the wallets off the new-customer event."
        }
      ]
    },
    {
      "code": "1.1.3",
      "name": "Open the wallets",
      "description": "One wallet per supported asset, all at zero and all opened with the withdrawal hold that only verification lifts. They are created from the customer event rather than by a call from identity, so there is a short window after signup in which the customer exists and has nowhere to put money. Creation is keyed on the customer and the asset, so a redelivered event opens nothing a second time.",
      "owner": "wallet",
      "node": "svc:wallet-service",
      "interaction": {
        "from": "svc:wallet-service",
        "kind": "db.write",
        "to": "db:postgres/wallet"
      },
      "touches": [
        "topic:users.created.v2"
      ]
    },
    {
      "code": "1.1.4",
      "name": "Start the session",
      "owner": "platform",
      "node": "svc:gateway-api",
      "interaction": {
        "from": "svc:gateway-api",
        "kind": "cache.write",
        "to": "cache:redis/session"
      }
    },
    {
      "code": "1.2",
      "name": "Verifying identity",
      "description": "Turning a registered account into one the platform may legally trade and pay out from. A rejection, or a request for further documents, travels the same path as an approval and is recorded the same way — it simply never produces the event that lifts the holds, so \"not yet verified\" and \"rejected\" look identical to every service except identity. Approval only ever lifts holds; nothing here re-applies them, so freezing an account afterwards — a sanctions hit, expired documents, a failed re-check — does not travel this path at all.",
      "owner": "identity",
      "trigger": "The verification provider returns a decision on the documents the customer submitted.",
      "outcome": "The customer record carries a decision, and on an approval the holds placed at signup are lifted."
    },
    {
      "code": "1.2.1",
      "name": "Record the verification result",
      "description": "Updates the KYC state on the record 1.1.1 created — the same table, minutes or days later, on a callback from a third-party verification provider the platform does not operate. Last write wins on the row, so a later decision can take an approved customer back to rejected, and every approval publishes 1.2.2 again, which is why 1.2.3 has to be safe to apply twice. Nothing orders the callbacks, and the row keeps only the current decision, so the history an audit of why a customer was approved would want is not in identity.",
      "owner": "risk-ops",
      "node": "svc:identity-service",
      "interaction": {
        "from": "svc:identity-service",
        "kind": "db.write",
        "to": "db:postgres/identity"
      },
      "next": [
        {
          "when": "the documents pass",
          "process": "L1.2.2"
        },
        {
          "when": "they do not",
          "process": "risk#1.2"
        }
      ]
    },
    {
      "code": "1.2.2",
      "name": "Announce approval",
      "description": "Only approvals are published; a rejection stays inside identity. The event, not the field, is what clears the wallet's withdrawal hold, and the order service takes it into its own copy of the state. A customer whose record reads approved while the event was never delivered therefore passes the pre-trade check, which reads identity directly, and is refused only when they try to take money out — a far more confusing failure than being refused outright.",
      "owner": "identity",
      "node": "svc:identity-service",
      "interaction": {
        "from": "svc:identity-service",
        "kind": "kafka.produce",
        "to": "topic:kyc.approved.v1"
      },
      "handsOffTo": [
        {
          "process": "L1.2.3",
          "note": "Wallet picks the approval off the topic and lifts the trading block."
        }
      ],
      "optional": true
    },
    {
      "code": "1.2.3",
      "name": "Enable trading on the wallet",
      "description": "The hold this lifts is on withdrawals, not on trading: until the event arrives a customer can pay money in and cannot take it out, and whether they may trade is decided by the order service, which consumes the same event into its own copy. Approval therefore takes effect in two places independently and can be live in one before the other. Deposits are accepted before verification completes, so a customer who is then refused is left holding money they cannot withdraw, and returning it to the card it came from is a manual job no component here performs.",
      "owner": "wallet",
      "node": "svc:wallet-service",
      "interaction": {
        "from": "svc:wallet-service",
        "kind": "kafka.consume",
        "to": "topic:kyc.approved.v1"
      },
      "handsOffTo": [
        {
          "process": "risk#1.1",
          "note": "Risk starts monitoring the account once it can trade."
        }
      ]
    },
    {
      "code": "1.3",
      "name": "Funding the account",